{
  "$schema": "https://json-schema.org/draft/2020-12/schema",
  "$id": "https://github.com/khoapnt-vng/WePrompt/blob/sprint3/docs/release/sprint3-internal/evidence-index.schema.json",
  "title": "Sprint 3 Internal Packaged Acceptance Evidence Index",
  "type": "object",
  "additionalProperties": false,
  "required": [
    "schemaVersion",
    "releaseChannel",
    "artifactIndex",
    "decisionReadiness",
    "bug017RuntimeRecoveryBuilt",
    "platforms"
  ],
  "properties": {
    "schemaVersion": { "const": 1 },
    "releaseChannel": { "const": "internal" },
    "artifactIndex": {
      "type": "object",
      "additionalProperties": false,
      "required": ["path", "sha256"],
      "properties": {
        "path": {
          "type": "string",
          "minLength": 1,
          "pattern": "^(?!/)(?![A-Za-z]:)(?!.*(?:^|/)\\.\\.(?:/|$))(?!.*\\\\).+\\.json$"
        },
        "sha256": { "$ref": "#/$defs/sha256" }
      }
    },
    "decisionReadiness": { "enum": ["not_ready", "ready_for_owner_decision"] },
    "bug017RuntimeRecoveryBuilt": { "type": "boolean" },
    "platforms": {
      "type": "array",
      "minItems": 2,
      "maxItems": 2,
      "prefixItems": [{ "$ref": "#/$defs/windowsPlatform" }, { "$ref": "#/$defs/macosPlatform" }],
      "items": false
    }
  },
  "$defs": {
    "sha256": {
      "type": "string",
      "pattern": "^[0-9a-f]{64}$"
    },
    "commit": {
      "type": "string",
      "pattern": "^[0-9a-f]{40}$"
    },
    "utc": {
      "type": "string",
      "pattern": "^\\d{4}-\\d{2}-\\d{2}T\\d{2}:\\d{2}:\\d{2}(?:\\.\\d{3})?Z$"
    },
    "artifact": {
      "type": "object",
      "additionalProperties": false,
      "required": [
        "name",
        "sha256",
        "wepromptCommit",
        "aioncoreVersion",
        "aioncoreCommit",
        "aioncoreBinarySha256",
        "bundleManifestSha256",
        "migrationLineageFingerprint"
      ],
      "properties": {
        "name": { "type": "string", "minLength": 1 },
        "sha256": { "$ref": "#/$defs/sha256" },
        "wepromptCommit": { "$ref": "#/$defs/commit" },
        "aioncoreVersion": { "const": "v0.1.55" },
        "aioncoreCommit": { "$ref": "#/$defs/commit" },
        "aioncoreBinarySha256": { "$ref": "#/$defs/sha256" },
        "bundleManifestSha256": { "$ref": "#/$defs/sha256" },
        "migrationLineageFingerprint": { "$ref": "#/$defs/sha256" }
      }
    },
    "environment": {
      "type": "object",
      "additionalProperties": false,
      "required": ["tester", "machine", "osBuild", "filesystem", "architecture", "snapshotId", "locale", "timezone"],
      "properties": {
        "tester": { "type": "string", "minLength": 1 },
        "machine": { "type": "string", "minLength": 1 },
        "osBuild": { "type": "string", "minLength": 1 },
        "filesystem": { "type": "string", "minLength": 1 },
        "architecture": { "enum": ["x64", "arm64"] },
        "snapshotId": { "type": "string", "minLength": 1 },
        "locale": { "type": "string", "minLength": 1 },
        "timezone": { "type": "string", "minLength": 1 }
      }
    },
    "evidence": {
      "type": "object",
      "additionalProperties": false,
      "required": ["kind", "path", "sha256"],
      "properties": {
        "kind": { "type": "string", "minLength": 1 },
        "path": { "type": "string", "minLength": 1, "pattern": "^(?!/)(?!.*(?:^|/)\\.\\.(?:/|$)).+$" },
        "sha256": { "$ref": "#/$defs/sha256" }
      }
    },
    "failure": {
      "type": "object",
      "additionalProperties": false,
      "required": ["reason", "owner", "preservedFixture"],
      "properties": {
        "reason": { "type": "string", "minLength": 1 },
        "owner": { "type": "string", "minLength": 1 },
        "preservedFixture": {
          "type": "object",
          "additionalProperties": false,
          "required": ["location", "sha256"],
          "properties": {
            "location": { "type": "string", "minLength": 1 },
            "sha256": { "$ref": "#/$defs/sha256" }
          }
        }
      }
    },
    "resultBase": {
      "type": "object",
      "required": ["id", "status", "startedAt", "endedAt", "notes", "evidence"],
      "properties": {
        "id": { "type": "string", "minLength": 1 },
        "status": { "enum": ["pass", "fail", "blocked"] },
        "startedAt": { "$ref": "#/$defs/utc" },
        "endedAt": { "$ref": "#/$defs/utc" },
        "notes": { "type": "string", "maxLength": 1000 },
        "evidence": {
          "type": "array",
          "minItems": 1,
          "items": { "$ref": "#/$defs/evidence" }
        },
        "failure": { "$ref": "#/$defs/failure" }
      },
      "allOf": [
        {
          "if": { "properties": { "status": { "const": "pass" } }, "required": ["status"] },
          "then": { "not": { "required": ["failure"] } },
          "else": { "required": ["failure"] }
        }
      ],
      "unevaluatedProperties": false
    },
    "scenario": {
      "$ref": "#/$defs/resultBase"
    },
    "scenarios": {
      "type": "array",
      "minItems": 12,
      "maxItems": 12,
      "prefixItems": [
        { "allOf": [{ "$ref": "#/$defs/scenario" }, { "properties": { "id": { "const": "S01_INSTALL" } } }] },
        { "allOf": [{ "$ref": "#/$defs/scenario" }, { "properties": { "id": { "const": "S02_SPRINT2_MIGRATION" } } }] },
        {
          "allOf": [{ "$ref": "#/$defs/scenario" }, { "properties": { "id": { "const": "S03_LINEAGE_FAIL_CLOSED" } } }]
        },
        { "allOf": [{ "$ref": "#/$defs/scenario" }, { "properties": { "id": { "const": "S04_HTTP_WS_AUTH" } } }] },
        { "allOf": [{ "$ref": "#/$defs/scenario" }, { "properties": { "id": { "const": "S05_MCP_OAUTH_TOOL" } } }] },
        { "allOf": [{ "$ref": "#/$defs/scenario" }, { "properties": { "id": { "const": "S06_OAUTH_EXPIRY" } } }] },
        { "allOf": [{ "$ref": "#/$defs/scenario" }, { "properties": { "id": { "const": "S07_OFFICECLI" } } }] },
        {
          "allOf": [
            { "$ref": "#/$defs/scenario" },
            { "properties": { "id": { "const": "S08_PRESENTATION_TEMPLATES" } } }
          ]
        },
        { "allOf": [{ "$ref": "#/$defs/scenario" }, { "properties": { "id": { "const": "S09_BUG017" } } }] },
        { "allOf": [{ "$ref": "#/$defs/scenario" }, { "properties": { "id": { "const": "S10_RESTART" } } }] },
        { "allOf": [{ "$ref": "#/$defs/scenario" }, { "properties": { "id": { "const": "S11_STUDIO_ABSENT" } } }] },
        { "allOf": [{ "$ref": "#/$defs/scenario" }, { "properties": { "id": { "const": "S12_UPDATE_ABSENT" } } }] }
      ],
      "items": false
    },
    "platformBase": {
      "type": "object",
      "additionalProperties": false,
      "required": ["platform", "artifact", "startedAt", "endedAt", "environment", "windowsGates", "scenarios"],
      "properties": {
        "platform": { "enum": ["windows-x64", "macos-arm64"] },
        "artifact": { "$ref": "#/$defs/artifact" },
        "startedAt": { "$ref": "#/$defs/utc" },
        "endedAt": { "$ref": "#/$defs/utc" },
        "environment": { "$ref": "#/$defs/environment" },
        "windowsGates": { "type": "array" },
        "scenarios": { "$ref": "#/$defs/scenarios" }
      }
    },
    "windowsPlatform": {
      "allOf": [
        { "$ref": "#/$defs/platformBase" },
        {
          "properties": {
            "platform": { "const": "windows-x64" },
            "environment": {
              "allOf": [{ "$ref": "#/$defs/environment" }, { "properties": { "architecture": { "const": "x64" } } }]
            },
            "windowsGates": {
              "type": "array",
              "minItems": 4,
              "maxItems": 4,
              "prefixItems": [
                {
                  "allOf": [
                    { "$ref": "#/$defs/resultBase" },
                    { "properties": { "id": { "const": "W01_NATIVE_SOURCE" } } }
                  ]
                },
                {
                  "allOf": [
                    { "$ref": "#/$defs/resultBase" },
                    { "properties": { "id": { "const": "W02_BUG043_FILESYSTEM" } } }
                  ]
                },
                {
                  "allOf": [
                    { "$ref": "#/$defs/resultBase" },
                    { "properties": { "id": { "const": "W03_BUG043_PACKAGED_FAIL_CLOSED" } } }
                  ]
                },
                {
                  "allOf": [
                    { "$ref": "#/$defs/resultBase" },
                    { "properties": { "id": { "const": "W04_INSTALLED_BUNDLE" } } }
                  ]
                }
              ],
              "items": false
            }
          }
        }
      ]
    },
    "macosPlatform": {
      "allOf": [
        { "$ref": "#/$defs/platformBase" },
        {
          "properties": {
            "platform": { "const": "macos-arm64" },
            "environment": {
              "allOf": [{ "$ref": "#/$defs/environment" }, { "properties": { "architecture": { "const": "arm64" } } }]
            },
            "windowsGates": { "type": "array", "maxItems": 0 }
          }
        }
      ]
    }
  }
}
